Certification,Provider,Duration,Cost,Certificate,Recommended_Month
DeepLearning.AI Machine Learning Specialization,Coursera (Stanford),1.5 months,"₹3,700",Yes,Month 1-2
DeepLearning.AI Generative AI Specialization,Coursera (DeepLearning.AI),1 month,"₹3,700",Yes,Month 3
Hugging Face Transformers Course,Hugging Face,3 weeks,Free,Yes,Month 3
Google Machine Learning Crash Course,Google,15-20 hours,Free,Yes,Month 2
IBM AI Engineering Professional Certificate,Coursera (IBM),3-6 months,Paid,Yes,Month 4-5
Prompt Engineering by DeepLearning.AI,DeepLearning.AI,3-5 hours,Free,Yes,Month 3
